{
  "$schema":"http://json-schema.org/draft-07/schema#","type":"object","additionalProperties":false,"required":["canvas","background","seed","objects"],
  "properties":{
    "canvas":{"type":"object","additionalProperties":false,"required":["width","height","fps","duration"],"properties":{"width":{"type":"integer","minimum":320,"maximum":3840},"height":{"type":"integer","minimum":240,"maximum":2160},"fps":{"type":"integer","enum":[24,25,30]},"duration":{"type":"number","exclusiveMinimum":0,"maximum":60}}},
    "background":{"type":"object","additionalProperties":false,"required":["type","value"],"properties":{"type":{"const":"solid"},"value":{"type":"string","pattern":"^#[0-9A-Fa-f]{6}$"}}},
    "seed":{"type":"integer","minimum":1,"maximum":2147483647},
    "objects":{"type":"array","minItems":1,"maxItems":40,"items":{"$ref":"#/definitions/object"}}
  },
  "definitions":{"point":{"type":"array","items":[{"type":"number"},{"type":"number"}],"additionalItems":false,"minItems":2,"maxItems":2},"object":{"type":"object","required":["id","type","x","y","start","duration","animation"],"properties":{"id":{"type":"string","pattern":"^[a-z0-9][a-z0-9-]*$"},"type":{"enum":["TEXT","LINE","ARROW","BOX","CIRCLE","ELLIPSE","ICON","SVG"]},"x":{"type":"number"},"y":{"type":"number"},"start":{"type":"number","minimum":0},"duration":{"type":"number","exclusiveMinimum":0},"animation":{"enum":["DRAW","WRITE_OR_REVEAL","FADE","HIGHLIGHT","MOVE","SCALE"]},"text":{"type":"string","maxLength":500},"font_size":{"type":"number","minimum":8,"maximum":200},"align":{"enum":["left","center","right"]},"from":{"$ref":"#/definitions/point"},"to":{"$ref":"#/definitions/point"},"width":{"type":"number","exclusiveMinimum":0},"height":{"type":"number","exclusiveMinimum":0},"radius":{"type":"number","exclusiveMinimum":0},"asset_id":{"type":"string","pattern":"^[a-z0-9][a-z0-9-]*$"},"target_x":{"type":"number"},"target_y":{"type":"number"},"stroke":{"type":"string"},"fill":{"type":"string"},"stroke_width":{"type":"number","exclusiveMinimum":0,"maximum":20}},"additionalProperties":false}}
}
